{
  "schemaVersion": 1,
  "id": "review-expiry-boundary",
  "requirementId": "semantic-review",
  "reviewer": {
    "kind": "agent-review",
    "role": "worker",
    "executionId": "actual-review-dispatch-id"
  },
  "implementationExecutionId": "actual-implementation-run-id",
  "conclusion": "approved",
  "criteria": [
    {
      "id": "public-api",
      "conclusion": "approved",
      "evidence": "The exported function signature is unchanged in the reviewed diff."
    }
  ],
  "findings": [
    {
      "id": "expiry-off-by-one",
      "status": "resolved",
      "description": "The boundary test compared with <= and accepted a token one second after expiry.",
      "resolution": "Commit 4f2c1a9 changes the comparison to < and adds the boundary case; the reviewed check passes."
    },
    {
      "id": "clock-skew-tolerance",
      "status": "accepted-risk",
      "description": "Tokens issued by a host whose clock runs ahead are rejected until the clocks agree.",
      "authority": "pm",
      "reason": "Hosts sync with NTP; the brief leaves skew handling out of scope."
    }
  ]
}
